{
  "label": "autonomous_verified_success",
  "justification": {
    "summary": "complete succeeded with deterministic passing evidence for every declared requirement and no avoidable intervention",
    "evidence_refs": [
      "b3:a1b2c3d4e5f60718a1b2c3d4e5f60718a1b2c3d4e5f60718a1b2c3d4e5f60718"
    ],
    "intervention_seqs": [],
    "entropy_seqs": []
  },
  "metrics": {
    "tool_calls": 3,
    "model_turns": 1,
    "tokens": 14400,
    "cost_usd": "0.2450",
    "wall_ms": 8420,
    "edits": 1,
    "verification_autonomy": 1.0,
    "context_meaningfulness": 0.6667,
    "tool_recovery_rate": 1.0,
    "attribution_completeness": 1.0,
    "entropy_delta": 0,
    "oracle_diversity": 1,
    "judge_only_evidence": 0,
    "retries": 0,
    "recovery_failures": 0,
    "permission_events": 0,
    "reverted_edits": 0,
    "replay_ok": true
  },
  "budget_totals": {
    "tokens": 14400,
    "cost_usd": "0.2450",
    "tool_calls": 3,
    "llm_calls": 1,
    "turns": 1,
    "wall_ms": 8420
  }
}
